{
  "$schema": "https://json-schema.org/draft/2020-12/schema",
  "$id": "urn:pathsmith:suite:0.1",
  "title": "Pathsmith scenario suite 0.1",
  "type": "object",
  "properties": {
    "formatVersion": {
      "const": "0.1"
    },
    "id": {
      "type": "string",
      "pattern": "^[A-Za-z][A-Za-z0-9_-]{0,63}$"
    },
    "name": {
      "type": "string"
    },
    "description": {
      "type": "string"
    },
    "scenarios": {
      "type": "array",
      "minItems": 1,
      "maxItems": 1000,
      "items": {
        "type": "object",
        "properties": {
          "id": {
            "type": "string",
            "pattern": "^[A-Za-z][A-Za-z0-9_-]{0,63}$"
          },
          "name": {
            "type": "string"
          },
          "tags": {
            "type": "array",
            "uniqueItems": true,
            "items": {
              "type": "string"
            }
          },
          "input": {
            "$ref": "#/$defs/jsonValue"
          },
          "expected": {
            "type": "object",
            "properties": {
              "allowedOutcomes": {
                "type": "array",
                "minItems": 1,
                "uniqueItems": true,
                "items": {
                  "type": "string",
                  "pattern": "^[A-Za-z][A-Za-z0-9_-]{0,63}$"
                }
              },
              "requiredNodes": {
                "type": "array",
                "uniqueItems": true,
                "items": {
                  "type": "string",
                  "pattern": "^[A-Za-z][A-Za-z0-9_-]{0,63}$"
                }
              },
              "forbiddenNodes": {
                "type": "array",
                "uniqueItems": true,
                "items": {
                  "type": "string",
                  "pattern": "^[A-Za-z][A-Za-z0-9_-]{0,63}$"
                }
              },
              "assertions": {
                "type": "array",
                "items": {
                  "$ref": "#/$defs/expr"
                }
              }
            },
            "required": [],
            "additionalProperties": false
          }
        },
        "required": [
          "id",
          "name",
          "tags",
          "input"
        ],
        "additionalProperties": false
      }
    }
  },
  "required": [
    "formatVersion",
    "id",
    "name",
    "description",
    "scenarios"
  ],
  "additionalProperties": false,
  "$defs": {
    "jsonValue": {
      "oneOf": [
        {
          "type": "null"
        },
        {
          "type": "boolean"
        },
        {
          "type": "number"
        },
        {
          "type": "string"
        },
        {
          "type": "array",
          "items": {
            "$ref": "#/$defs/jsonValue"
          }
        },
        {
          "type": "object",
          "additionalProperties": {
            "$ref": "#/$defs/jsonValue"
          }
        }
      ]
    },
    "expr": {
      "oneOf": [
        {
          "type": "object",
          "properties": {
            "op": {
              "const": "literal"
            },
            "value": {
              "$ref": "#/$defs/jsonValue"
            }
          },
          "required": [
            "op",
            "value"
          ],
          "additionalProperties": false
        },
        {
          "type": "object",
          "properties": {
            "op": {
              "const": "ref"
            },
            "path": {
              "type": "array",
              "minItems": 1,
              "items": {
                "oneOf": [
                  {
                    "type": "string"
                  },
                  {
                    "type": "integer",
                    "minimum": 0
                  }
                ]
              }
            }
          },
          "required": [
            "op",
            "path"
          ],
          "additionalProperties": false
        },
        {
          "type": "object",
          "properties": {
            "op": {
              "const": "object"
            },
            "fields": {
              "type": "object",
              "additionalProperties": {
                "$ref": "#/$defs/expr"
              }
            }
          },
          "required": [
            "op",
            "fields"
          ],
          "additionalProperties": false
        },
        {
          "type": "object",
          "properties": {
            "op": {
              "const": "array"
            },
            "items": {
              "type": "array",
              "items": {
                "$ref": "#/$defs/expr"
              }
            }
          },
          "required": [
            "op",
            "items"
          ],
          "additionalProperties": false
        },
        {
          "type": "object",
          "properties": {
            "op": {
              "enum": [
                "eq",
                "ne",
                "gt",
                "gte",
                "lt",
                "lte",
                "add",
                "sub",
                "mul",
                "div",
                "in"
              ]
            },
            "left": {
              "$ref": "#/$defs/expr"
            },
            "right": {
              "$ref": "#/$defs/expr"
            }
          },
          "required": [
            "op",
            "left",
            "right"
          ],
          "additionalProperties": false
        },
        {
          "type": "object",
          "properties": {
            "op": {
              "enum": [
                "and",
                "or",
                "coalesce"
              ]
            },
            "args": {
              "type": "array",
              "minItems": 1,
              "items": {
                "$ref": "#/$defs/expr"
              }
            }
          },
          "required": [
            "op",
            "args"
          ],
          "additionalProperties": false
        },
        {
          "type": "object",
          "properties": {
            "op": {
              "enum": [
                "not",
                "exists"
              ]
            },
            "value": {
              "$ref": "#/$defs/expr"
            }
          },
          "required": [
            "op",
            "value"
          ],
          "additionalProperties": false
        }
      ]
    }
  }
}
